{
  "$schema": "../schema.json",
  "schemaVersion": 2,
  "id": "melodic-techno",
  "label": "Melodic Techno",
  "version": 3,
  "order": 60,
  "bpmTolerance": 6,
  "coreLanes": [0, 4, 6],
  "pairPan": 0.55,
  "returns": [
    { "module": "aetherform-reverb", "preset": "Dark Hall", "returnLevel": 0.34 },
    { "module": "echoform-delay", "preset": "Dotted Motion", "returnLevel": 0.3 }
  ],
  "arcs": [
    {
      "name": "Long Build",
      "sections": [
        { "name": "Percussive Intro", "weight": 11, "activeLanes": [0, 9, 10, 14], "phraseMode": "build" },
        { "name": "Bass Entry", "weight": 15, "activeLanes": [0, 1, 2, 4, 9, 11, 14, 15], "phraseMode": "steady" },
        { "name": "Motif Reveal", "weight": 16, "activeLanes": [0, 1, 2, 3, 4, 5, 6, 11, 12, 14], "phraseMode": "steady" },
        { "name": "Atmospheric Break", "weight": 13, "activeLanes": [6, 8, 9, 10, 12, 14], "phraseMode": "steady" },
        { "name": "Motif Return", "weight": 10, "activeLanes": [0, 1, 2, 3, 4, 5, 6, 7, 12, 13, 15], "phraseMode": "steady" },
        { "name": "Drive", "weight": 8, "activeLanes": [0, 2, 3, 4, 6, 8, 11, 13, 15], "phraseMode": "steady" },
        { "name": "Melodic Peak", "weight": 15, "activeLanes": [0, 1, 2, 3, 4, 5, 6, 7, 8, 13, 15], "phraseMode": "steady" },
        { "name": "Outro", "weight": 12, "activeLanes": [0, 4, 6, 9, 10], "phraseMode": "outro" }
      ],
      "ops": [
        { "op": "swap", "lane": 6, "at": "Motif Return" },
        { "op": "swap", "lane": 5, "at": "Melodic Peak" },
        { "op": "roll", "lane": 3, "at": "Motif Return", "bars": 2 },
        { "op": "tail", "lane": 9, "at": "Atmospheric Break" },
        { "op": "tail", "lane": 10, "at": "Outro" }
      ]
    },
    {
      "name": "Twin Peak",
      "sections": [
        { "name": "Percussive Intro", "weight": 10, "activeLanes": [0, 10, 12, 14], "phraseMode": "build" },
        { "name": "Motif Reveal", "weight": 16, "activeLanes": [0, 1, 2, 4, 5, 6, 11, 14, 15], "phraseMode": "steady" },
        { "name": "First Peak", "weight": 16, "activeLanes": [0, 1, 2, 3, 4, 5, 6, 7, 12, 13, 15], "phraseMode": "steady" },
        { "name": "Atmospheric Break", "weight": 14, "activeLanes": [6, 8, 9, 10, 12, 14], "phraseMode": "steady" },
        { "name": "Bass Entry", "weight": 12, "activeLanes": [0, 2, 3, 4, 9, 11, 14], "phraseMode": "build" },
        { "name": "Melodic Peak", "weight": 20, "activeLanes": [0, 1, 2, 3, 4, 5, 6, 7, 8, 11, 13, 15], "phraseMode": "steady" },
        { "name": "Outro", "weight": 12, "activeLanes": [0, 4, 6, 9, 10], "phraseMode": "outro" }
      ],
      "ops": [
        { "op": "swap", "lane": 6, "at": "First Peak" },
        { "op": "swap", "lane": 6, "at": "Melodic Peak" },
        { "op": "roll", "lane": 3, "at": "Melodic Peak", "bars": 3 },
        { "op": "tail", "lane": 9, "at": "Atmospheric Break" },
        { "op": "rest", "lane": 13, "from": "Atmospheric Break", "to": "Bass Entry" }
      ]
    }
  ],
  "lanes": [
    { "name": "Kick", "types": ["Kick"], "maxBars": 1, "maxBeats": 2, "role": "percussion", "beatPattern": [0, 8, 16, 24], "beatMutation": [0, 8, 16, 24, 30], "gain": 0.76, "pan": 0, "sends": [0, 0] },
    { "name": "Restrained Clap", "types": ["Snare", "Percussion"], "maxBars": 1, "maxBeats": 2, "role": "percussion", "beatPattern": [8, 24], "beatMutation": [8, 24, 28], "gain": 0.4, "pan": 0.05, "sends": [0.12, 0] },
    { "name": "Hi-hat", "types": ["Hi-hat", "Percussion"], "maxBars": 1, "maxBeats": 2, "role": "percussion", "beatPattern": [4, 12, 20, 28], "beatMutation": [2, 6, 10, 14, 18, 22, 26, 30], "gain": 0.4, "pan": 0.15, "sends": [0.05, 0.1] },
    { "name": "Shaker / Rim", "types": ["Percussion", "Other"], "maxBars": 1, "maxBeats": 2, "role": "percussion", "beatPattern": [6, 10, 20, 24, 28], "beatMutation": [6, 8, 10, 20, 24, 26, 28], "gain": 0.34, "pan": -0.18, "sends": [0.1, 0] },
    { "name": "Rumble Bass", "types": ["Bass"], "maxBars": 8, "role": "motif", "gain": 0.62, "pan": 0, "sends": [0, 0] },
    { "name": "Rolling Bass", "types": ["Bass", "Loop"], "maxBars": 8, "role": "motif", "gain": 0.6, "pan": 0, "sends": [0, 0.06] },
    { "name": "Arp", "types": ["Loop", "Synth"], "maxBars": 8, "role": "motif", "gain": 0.5, "pan": -0.1, "sends": [0.14, 0.28] },
    { "name": "Lead", "types": ["Synth", "Loop"], "maxBars": 8, "role": "motif", "gain": 0.52, "pan": 0.1, "sends": [0.22, 0.32] },
    { "name": "Voice", "types": ["Vocal", "Atmosphere"], "maxBars": 8, "role": "vocal", "gain": 0.48, "pan": 0, "sends": [0.28, 0.3] },
    { "name": "Sphere", "types": ["Atmosphere", "Other"], "maxBars": 16, "role": "atmosphere", "preferLong": true, "gain": 0.34, "pan": -0.2, "sends": [0.3, 0] },
    { "name": "Pad", "types": ["Atmosphere", "Synth"], "maxBars": 16, "role": "atmosphere", "preferLong": true, "gain": 0.4, "pan": 0.12, "sends": [0.28, 0] },
    { "name": "Drum Loop", "types": ["Percussion", "Hi-hat", "Snare"], "maxBars": 4, "role": "motif", "preferLong": true, "gain": 0.42, "pan": -0.28, "sends": [0.08, 0] },
    { "name": "Texture", "types": ["FX", "Other"], "maxBars": 16, "role": "motif", "preferLong": true, "gain": 0.36, "pan": 0.28, "sends": [0.2, 0.15] },
    { "name": "Harmony Layer", "types": ["Synth", "Loop"], "maxBars": 8, "role": "motif", "gain": 0.38, "pan": -0.32, "sends": [0.18, 0.2] },
    { "name": "Riser", "types": ["FX", "Other"], "maxBars": 8, "role": "transition", "transitionKind": "riser", "gain": 0.32, "pan": 0, "sends": [0.2, 0] },
    { "name": "Impact", "types": ["FX", "Other"], "maxBars": 8, "role": "transition", "transitionKind": "impact", "gain": 0.32, "pan": 0, "sends": [0.2, 0] }
  ]
}
