{
  "$schema": "../schema.json",
  "schemaVersion": 2,
  "id": "trance",
  "label": "Trance",
  "version": 6,
  "order": 20,
  "bpmTolerance": 6,
  "coreLanes": [0, 4, 5],
  "returns": [
    { "module": "aetherform-reverb", "preset": "Ambient Bloom", "returnLevel": 0.36 },
    { "module": "echoform-delay", "preset": "Dotted Motion", "returnLevel": 0.34 }
  ],
  "arcs": [
    {
      "name": "Classic Breakdown",
      "sections": [
        { "name": "Intro", "weight": 12, "activeLanes": [5, 9, 10, 14], "phraseMode": "build" },
        { "name": "Groove", "weight": 18, "activeLanes": [0, 1, 2, 4, 5, 11, 14, 15], "phraseMode": "steady" },
        { "name": "Breakdown", "weight": 12, "activeLanes": [7, 8, 9, 10, 14], "phraseMode": "steady" },
        { "name": "Rebuild", "weight": 12, "activeLanes": [0, 2, 3, 4, 7, 10, 14], "phraseMode": "build" },
        { "name": "Drop", "weight": 18, "activeLanes": [0, 1, 2, 3, 4, 5, 6, 11, 13, 15], "phraseMode": "steady" },
        { "name": "Bridge", "weight": 11, "activeLanes": [0, 1, 2, 4, 5, 7, 8, 10, 12, 14], "phraseMode": "steady" },
        { "name": "Peak", "weight": 11, "activeLanes": [0, 1, 2, 3, 4, 5, 6, 11, 12, 13, 15], "phraseMode": "steady" },
        { "name": "Outro", "weight": 6, "activeLanes": [0, 2, 5, 9, 10], "phraseMode": "outro" }
      ],
      "ops": [
        { "op": "swap", "lane": 5, "at": "Drop" },
        { "op": "swap", "lane": 2, "at": "Peak" },
        { "op": "roll", "lane": 3, "at": "Drop", "bars": 2 },
        { "op": "roll", "lane": 3, "at": "Peak", "bars": 3 },
        { "op": "tail", "lane": 7, "at": "Rebuild" },
        { "op": "tail", "lane": 9, "at": "Outro" }
      ]
    },
    {
      "name": "Late Breakdown",
      "sections": [
        { "name": "Intro", "weight": 10, "activeLanes": [5, 10, 14], "phraseMode": "build" },
        { "name": "Groove", "weight": 16, "activeLanes": [0, 1, 2, 4, 5, 11, 14, 15], "phraseMode": "steady" },
        { "name": "Drop", "weight": 18, "activeLanes": [0, 1, 2, 3, 4, 5, 6, 11, 13, 15], "phraseMode": "steady" },
        { "name": "Bridge", "weight": 12, "activeLanes": [0, 2, 4, 5, 7, 12, 14], "phraseMode": "steady" },
        { "name": "Breakdown", "weight": 13, "activeLanes": [7, 8, 9, 10, 14], "phraseMode": "steady" },
        { "name": "Rebuild", "weight": 9, "activeLanes": [0, 2, 3, 4, 7, 10, 14], "phraseMode": "build" },
        { "name": "Peak", "weight": 15, "activeLanes": [0, 1, 2, 3, 4, 5, 6, 11, 12, 13, 15], "phraseMode": "steady" },
        { "name": "Outro", "weight": 7, "activeLanes": [0, 2, 5, 9, 10], "phraseMode": "outro" }
      ],
      "ops": [
        { "op": "swap", "lane": 5, "at": "Drop" },
        { "op": "swap", "lane": 6, "at": "Peak" },
        { "op": "roll", "lane": 3, "at": "Peak", "bars": 3 },
        { "op": "tail", "lane": 7, "at": "Breakdown" },
        { "op": "rest", "lane": 11, "from": "Bridge", "to": "Rebuild" }
      ]
    }
  ],
  "lanes": [
    { "name": "Kick", "types": ["Kick"], "maxBars": 1, "maxBeats": 2, "role": "percussion", "beatPattern": [0, 8, 16, 24], "beatMutation": [0, 8, 16, 24, 28], "gain": 0.78, "pan": 0, "sends": [0, 0] },
    { "name": "Clap / Snare", "types": ["Snare", "Percussion"], "maxBars": 1, "maxBeats": 2, "role": "percussion", "beatPattern": [8, 24], "beatMutation": [8, 24, 28], "gain": 0.44, "pan": 0.05, "sends": [0.12, 0] },
    { "name": "Offbeat Hi-hat", "types": ["Hi-hat", "Percussion"], "maxBars": 1, "maxBeats": 2, "role": "percussion", "beatPattern": [4, 12, 20, 28], "beatMutation": [2, 6, 10, 14, 18, 22, 26, 30], "gain": 0.4, "pan": -0.1, "sends": [0.06, 0] },
    { "name": "Roll Percussion", "types": ["Percussion", "Other"], "maxBars": 1, "maxBeats": 2, "role": "percussion", "beatPattern": [2, 10, 18, 26], "beatMutation": [3, 7, 11, 15, 19, 23, 27, 31], "gain": 0.36, "pan": 0.12, "sends": [0.12, 0] },
    { "name": "Offbeat Bass", "types": ["Bass"], "maxBars": 8, "role": "motif", "gain": 0.64, "pan": 0, "sends": [0, 0] },
    { "name": "Arpeggio Loop", "types": ["Loop", "Synth"], "maxBars": 8, "role": "motif", "gain": 0.5, "pan": 0.1, "sends": [0.1, 0.3] },
    { "name": "Lead Theme", "types": ["Synth", "Loop"], "maxBars": 8, "role": "motif", "gain": 0.48, "pan": 0, "sends": [0.15, 0.28] },
    { "name": "Pad Chords", "types": ["Synth", "Loop"], "maxBars": 8, "role": "motif", "preferLong": true, "gain": 0.36, "pan": -0.05, "sends": [0.3, 0] },
    { "name": "Vocal", "types": ["Vocal", "Atmosphere"], "maxBars": 8, "role": "vocal", "gain": 0.44, "pan": 0, "sends": [0.25, 0.25] },
    { "name": "Sphere", "types": ["Atmosphere", "Other"], "maxBars": 16, "role": "atmosphere", "preferLong": true, "gain": 0.32, "pan": -0.15, "sends": [0.3, 0] },
    { "name": "FX Wash", "types": ["FX", "Other"], "maxBars": 16, "role": "atmosphere", "preferLong": true, "gain": 0.4, "pan": 0.2, "sends": [0.2, 0.1] },
    { "name": "Percussion Loop", "types": ["Percussion", "Hi-hat", "Snare"], "maxBars": 4, "role": "motif", "preferLong": true, "gain": 0.42, "pan": -0.2, "sends": [0.06, 0] },
    { "name": "Arpeggio Variation", "types": ["Loop", "Synth"], "maxBars": 8, "role": "motif", "gain": 0.44, "pan": 0.25, "sends": [0.1, 0.2] },
    { "name": "Theme Layer", "types": ["Synth", "Loop"], "maxBars": 8, "role": "motif", "gain": 0.38, "pan": -0.25, "sends": [0.1, 0.2] },
    { "name": "Riser", "types": ["FX", "Other"], "maxBars": 8, "role": "transition", "transitionKind": "riser", "gain": 0.34, "pan": 0, "sends": [0.2, 0] },
    { "name": "Impact", "types": ["FX", "Other"], "maxBars": 8, "role": "transition", "transitionKind": "impact", "gain": 0.34, "pan": 0, "sends": [0.2, 0] }
  ]
}
