{
  "$schema": "../schema.json",
  "schemaVersion": 2,
  "id": "house",
  "label": "House",
  "version": 6,
  "order": 30,
  "bpmTolerance": 8,
  "coreLanes": [0, 2, 4],
  "pairPan": 0.45,
  "returns": [
    { "module": "aetherform-reverb", "preset": "Vocal Plate", "returnLevel": 0.32 },
    { "module": "echoform-delay", "preset": "Clean Slap", "returnLevel": 0.26 }
  ],
  "arcs": [
    {
      "name": "Classic House",
      "sections": [
        { "name": "Intro", "weight": 10, "activeLanes": [9, 10, 14], "phraseMode": "build" },
        { "name": "Groove", "weight": 16, "activeLanes": [0, 1, 2, 4, 5, 10, 11, 12, 14, 15], "phraseMode": "steady" },
        { "name": "Vocal Entry", "weight": 14, "activeLanes": [0, 1, 2, 3, 4, 5, 8, 11, 12, 13, 14], "phraseMode": "steady" },
        { "name": "Main Groove", "weight": 18, "activeLanes": [0, 1, 2, 3, 4, 5, 6, 8, 10, 11, 12, 13, 15], "phraseMode": "steady" },
        { "name": "Breakdown", "weight": 12, "activeLanes": [5, 7, 8, 9, 10, 14], "phraseMode": "steady" },
        { "name": "Rebuild", "weight": 8, "activeLanes": [0, 2, 3, 4, 5, 10, 14], "phraseMode": "build" },
        { "name": "Peak", "weight": 14, "activeLanes": [0, 1, 2, 3, 4, 5, 6, 7, 8, 11, 12, 13, 15], "phraseMode": "steady" },
        { "name": "Outro", "weight": 8, "activeLanes": [0, 2, 4, 9, 10], "phraseMode": "outro" }
      ],
      "ops": [
        { "op": "swap", "lane": 5, "at": "Main Groove" },
        { "op": "swap", "lane": 1, "at": "Peak" },
        { "op": "roll", "lane": 3, "at": "Main Groove", "bars": 2 },
        { "op": "roll", "lane": 3, "at": "Peak", "bars": 2 },
        { "op": "tail", "lane": 9, "at": "Breakdown" },
        { "op": "tail", "lane": 10, "at": "Outro" }
      ]
    },
    {
      "name": "Vocal Lift",
      "sections": [
        { "name": "Intro", "weight": 9, "activeLanes": [9, 12, 14], "phraseMode": "build" },
        { "name": "Groove", "weight": 15, "activeLanes": [0, 1, 2, 4, 5, 10, 11, 12, 14, 15], "phraseMode": "steady" },
        { "name": "Break", "weight": 12, "activeLanes": [5, 7, 8, 9, 10, 14], "phraseMode": "steady" },
        { "name": "Lift", "weight": 10, "activeLanes": [0, 2, 3, 4, 5, 8, 10, 14], "phraseMode": "build" },
        { "name": "Main Groove", "weight": 20, "activeLanes": [0, 1, 2, 3, 4, 5, 6, 8, 10, 11, 12, 13, 15], "phraseMode": "steady" },
        { "name": "Stripped", "weight": 10, "activeLanes": [0, 4, 7, 9, 10, 14], "phraseMode": "steady" },
        { "name": "Peak", "weight": 15, "activeLanes": [0, 1, 2, 3, 4, 5, 6, 7, 8, 11, 12, 13, 15], "phraseMode": "steady" },
        { "name": "Outro", "weight": 9, "activeLanes": [0, 2, 4, 9, 10], "phraseMode": "outro" }
      ],
      "ops": [
        { "op": "swap", "lane": 5, "at": "Main Groove" },
        { "op": "swap", "lane": 6, "at": "Peak" },
        { "op": "roll", "lane": 3, "at": "Main Groove", "bars": 3 },
        { "op": "tail", "lane": 9, "at": "Break" },
        { "op": "rest", "lane": 11, "from": "Break", "to": "Lift" }
      ]
    }
  ],
  "lanes": [
    { "name": "Kick", "types": ["Kick"], "maxBars": 1, "maxBeats": 2, "role": "percussion", "beatPattern": [0, 8, 16, 24], "beatMutation": [0, 8, 16, 24, 30], "gain": 0.78, "pan": 0, "sends": [0, 0] },
    { "name": "Clap", "types": ["Snare", "Percussion"], "maxBars": 1, "maxBeats": 2, "role": "percussion", "beatPattern": [8, 24], "beatMutation": [8, 24, 28], "gain": 0.48, "pan": 0.05, "sends": [0.15, 0] },
    { "name": "Offbeat Hi-hat", "types": ["Hi-hat", "Percussion"], "maxBars": 1, "maxBeats": 2, "role": "percussion", "beatPattern": [4, 12, 20, 28], "beatMutation": [2, 6, 10, 14, 18, 22, 26, 30], "gain": 0.42, "pan": 0.15, "sends": [0.08, 0] },
    { "name": "Shaker / Conga", "types": ["Percussion", "Other"], "maxBars": 1, "maxBeats": 2, "role": "percussion", "beatPattern": [5, 13, 21, 29], "beatMutation": [3, 11, 19, 27], "gain": 0.4, "pan": -0.12, "sends": [0.12, 0] },
    { "name": "Syncopated Bass", "types": ["Bass"], "maxBars": 8, "role": "motif", "gain": 0.66, "pan": 0, "sends": [0, 0] },
    { "name": "Organ Chords", "types": ["Loop", "Synth"], "maxBars": 8, "role": "motif", "gain": 0.5, "pan": -0.1, "sends": [0.18, 0.12] },
    { "name": "Organ Riff", "types": ["Synth", "Loop"], "maxBars": 8, "role": "motif", "gain": 0.52, "pan": 0.1, "sends": [0.2, 0.15] },
    { "name": "Synth Stabs", "types": ["Synth", "Loop"], "maxBars": 8, "role": "motif", "gain": 0.44, "pan": 0.18, "sends": [0.16, 0.2] },
    { "name": "Vocal", "types": ["Vocal", "Atmosphere"], "maxBars": 8, "role": "vocal", "gain": 0.54, "pan": 0, "sends": [0.22, 0.25] },
    { "name": "Sphere", "types": ["Atmosphere", "Other"], "maxBars": 16, "role": "atmosphere", "preferLong": true, "gain": 0.34, "pan": -0.3, "sends": [0.3, 0] },
    { "name": "FX Wash", "types": ["FX", "Other"], "maxBars": 16, "role": "atmosphere", "preferLong": true, "gain": 0.44, "pan": 0.2, "sends": [0.2, 0] },
    { "name": "Percussion Loop", "types": ["Percussion", "Hi-hat", "Snare"], "maxBars": 4, "role": "motif", "preferLong": true, "gain": 0.42, "pan": 0.25, "sends": [0.08, 0.1] },
    { "name": "Groove Layer", "types": ["Loop", "Synth"], "maxBars": 8, "role": "motif", "gain": 0.44, "pan": -0.22, "sends": [0.08, 0.1] },
    { "name": "Guitar / String Layer", "types": ["Synth", "Loop"], "maxBars": 8, "role": "motif", "gain": 0.44, "pan": 0.3, "sends": [0.12, 0.15] },
    { "name": "Riser", "types": ["FX", "Other"], "maxBars": 8, "role": "transition", "transitionKind": "riser", "gain": 0.34, "pan": 0, "sends": [0.2, 0] },
    { "name": "Impact", "types": ["FX", "Other"], "maxBars": 8, "role": "transition", "transitionKind": "impact", "gain": 0.34, "pan": 0, "sends": [0.2, 0.1] }
  ]
}
