{
  "$schema": "../schema.json",
  "schemaVersion": 2,
  "id": "ambient-house",
  "label": "Ambient House",
  "version": 3,
  "order": 50,
  "bpmTolerance": 10,
  "coreLanes": [6, 9],
  "pairPan": 0.6,
  "returns": [
    { "module": "aetherform-reverb", "preset": "Shimmer Cloud", "returnLevel": 0.38 },
    { "module": "echoform-delay", "preset": "Endless Wash", "returnLevel": 0.32 }
  ],
  "arcs": [
    {
      "name": "Drift",
      "sections": [
        { "name": "Atmosphere Intro", "weight": 8, "activeLanes": [9, 10, 14], "phraseMode": "build" },
        { "name": "Pulse In", "weight": 13, "activeLanes": [0, 6, 9, 12, 14], "phraseMode": "build" },
        { "name": "Groove", "weight": 24, "activeLanes": [0, 1, 2, 4, 5, 6, 7, 10, 11, 13, 15], "phraseMode": "steady" },
        { "name": "Dissolve", "weight": 13, "activeLanes": [7, 8, 9, 10, 12, 14], "phraseMode": "steady" },
        { "name": "Pulse Return", "weight": 20, "activeLanes": [0, 1, 2, 3, 4, 5, 6, 8, 10, 11, 13, 15], "phraseMode": "steady" },
        { "name": "Open Sky", "weight": 12, "activeLanes": [0, 5, 6, 7, 8, 10, 12, 13, 15], "phraseMode": "steady" },
        { "name": "Fade", "weight": 10, "activeLanes": [6, 9, 10, 12], "phraseMode": "outro" }
      ],
      "ops": [
        { "op": "swap", "lane": 6, "at": "Pulse Return" },
        { "op": "swap", "lane": 5, "at": "Open Sky" },
        { "op": "tail", "lane": 9, "at": "Dissolve" },
        { "op": "tail", "lane": 7, "at": "Open Sky" },
        { "op": "rest", "lane": 11, "from": "Dissolve", "to": "Dissolve" }
      ]
    },
    {
      "name": "Late Groove",
      "sections": [
        { "name": "Atmosphere Intro", "weight": 10, "activeLanes": [9, 12, 14], "phraseMode": "build" },
        { "name": "Dissolve", "weight": 14, "activeLanes": [7, 8, 9, 10, 12, 14], "phraseMode": "steady" },
        { "name": "Pulse In", "weight": 12, "activeLanes": [0, 6, 9, 10, 12, 14], "phraseMode": "build" },
        { "name": "Groove", "weight": 24, "activeLanes": [0, 1, 2, 4, 5, 6, 7, 10, 11, 13, 15], "phraseMode": "steady" },
        { "name": "Open Sky", "weight": 14, "activeLanes": [0, 5, 6, 7, 8, 10, 12, 13, 15], "phraseMode": "steady" },
        { "name": "Pulse Return", "weight": 16, "activeLanes": [0, 1, 2, 3, 4, 5, 6, 8, 10, 11, 13, 15], "phraseMode": "steady" },
        { "name": "Fade", "weight": 10, "activeLanes": [6, 9, 10, 12], "phraseMode": "outro" }
      ],
      "ops": [
        { "op": "swap", "lane": 6, "at": "Groove" },
        { "op": "swap", "lane": 13, "at": "Pulse Return" },
        { "op": "tail", "lane": 9, "at": "Dissolve" },
        { "op": "rest", "lane": 11, "from": "Open Sky", "to": "Open Sky" }
      ]
    }
  ],
  "lanes": [
    { "name": "Soft Pulse", "types": ["Kick"], "maxBars": 1, "maxBeats": 2, "role": "percussion", "beatPattern": [0, 8, 16, 24], "beatMutation": [0, 16], "gain": 0.6, "pan": 0, "sends": [0.05, 0] },
    { "name": "Sparse Clap", "types": ["Snare", "Percussion"], "maxBars": 1, "maxBeats": 2, "role": "percussion", "beatPattern": [24], "beatMutation": [8, 24], "gain": 0.3, "pan": 0.18, "sends": [0.12, 0] },
    { "name": "Shimmer Hi-hat", "types": ["Hi-hat", "Percussion"], "maxBars": 1, "maxBeats": 2, "role": "percussion", "beatPattern": [4, 20], "beatMutation": [4, 12, 20, 28], "gain": 0.32, "pan": -0.3, "sends": [0.15, 0.15] },
    { "name": "Soft Percussion", "types": ["Percussion", "Other"], "maxBars": 1, "maxBeats": 2, "role": "percussion", "beatPattern": [6, 22], "beatMutation": [6, 14, 22, 30], "gain": 0.3, "pan": 0.3, "sends": [0.15, 0.15] },
    { "name": "Dub Bass", "types": ["Bass"], "maxBars": 8, "role": "motif", "gain": 0.6, "pan": 0, "sends": [0, 0.15] },
    { "name": "Drum Loop", "types": ["Loop", "Percussion"], "maxBars": 4, "role": "motif", "preferLong": true, "gain": 0.44, "pan": 0.05, "sends": [0.1, 0.1] },
    { "name": "Pads", "types": ["Synth", "Loop"], "maxBars": 8, "role": "motif", "preferLong": true, "gain": 0.4, "pan": -0.05, "sends": [0.3, 0.15] },
    { "name": "Guitar", "types": ["Synth", "Loop"], "maxBars": 8, "role": "motif", "gain": 0.46, "pan": -0.15, "sends": [0.28, 0.3] },
    { "name": "Voice FX", "types": ["Vocal", "Atmosphere"], "maxBars": 8, "role": "vocal", "gain": 0.4, "pan": 0.35, "sends": [0.3, 0.35] },
    { "name": "Sphere", "types": ["Atmosphere", "Other"], "maxBars": 16, "role": "atmosphere", "preferLong": true, "gain": 0.36, "pan": 0.1, "sends": [0.32, 0] },
    { "name": "Washes", "types": ["FX", "Other"], "maxBars": 16, "role": "atmosphere", "preferLong": true, "gain": 0.4, "pan": 0.2, "sends": [0.25, 0] },
    { "name": "Pulse Loop", "types": ["Percussion", "Hi-hat", "Snare"], "maxBars": 4, "role": "motif", "preferLong": true, "gain": 0.32, "pan": -0.25, "sends": [0.15, 0.15] },
    { "name": "Texture", "types": ["FX", "Other"], "maxBars": 16, "role": "motif", "preferLong": true, "gain": 0.36, "pan": -0.35, "sends": [0.25, 0.2] },
    { "name": "Synth Pad", "types": ["Atmosphere", "Synth"], "maxBars": 16, "role": "motif", "preferLong": true, "gain": 0.34, "pan": 0.25, "sends": [0.3, 0] },
    { "name": "Swell", "types": ["FX", "Other"], "maxBars": 8, "role": "transition", "transitionKind": "riser", "gain": 0.3, "pan": 0, "sends": [0.25, 0] },
    { "name": "Soft Impact", "types": ["FX", "Other"], "maxBars": 8, "role": "transition", "transitionKind": "impact", "gain": 0.3, "pan": 0, "sends": [0.25, 0] }
  ]
}
